 Sheik F A F Bacchus,Bacchus, Sheik F A F, West Indies,19,29,  
 Adam M Bacher,Bacher, Adam M, South Africa,19,13,  
 Aron A Bacher,Bacher, Aron A, South Africa,12,  ,  
 Hemang K Badani,Badani, Hemang K, India,4,40,  
 Clayvel L Badcock,Badcock, Clayvel L, Australia,7,  ,  
 Frederick T Badcock,Badcock, Frederick T, New Zealand,7,  ,  
 Subramaniam Badrinath,Badrinath, Subramaniam, India,2,7,1
 Ashish Bagai,Bagai, Ashish, Canada,  ,60,7
 Sairaj V Bahutule,Bahutule, Sairaj V, India,2,8,  
 Leonard Baichan,Baichan, Leonard, West Indies,3,  ,  
 Harvir S Baidwan,Baidwan, Harvir S, Canada,  ,28,11
 Abbas A Baig,Baig, Abbas A, India,10,  ,  
 Mark D Bailey,Bailey, Mark D, New Zealand,  ,1,  
 Robert J Bailey,Bailey, Robert J, England,4,4,  
 Trevor E Bailey,Bailey, Trevor E, England,61,  ,  
 David L Bairstow,Bairstow, David L, England,4,21,  
 Jonathan M Bairstow,Bairstow, Jonathan M, England,  ,6,3
 Lionel S Baker,Baker, Lionel S, West Indies,4,10,3
 Alfred H Bakewell,Bakewell, Alfred H, England,6,  ,  
 Paul-Jan Bakker,Bakker, Paul-Jan, Netherlands,  ,5,  
 Showkat Baksh,Baksh, Showkat, Canada,  ,1,  
 Lakshmipathy Balaji,Balaji, Lakshmipathy, India,8,30,  
 W Dorakanti Balaji Rao,Balaji Rao, W Dorakanti, Canada,  ,10,4
 Xenophon C Balaskas,Balaskas, Xenophon C, South Africa,9,  ,  
 Andrew Balbirnie,Balbirnie, Andrew, Ireland,  ,4,  
 John C Balderstone,Balderstone, John C, England,2,  ,  
 C Malinga Bandara,Bandara, C Malinga, Sri Lanka,8,31,4
 M R C Niroshan Bandarathilake,Bandarathilake, M R C Niroshan, Sri Lanka,7,3,  
 Shute N Banerjee,Banerjee, Shute N, India,1,  ,  
 Subroto T Banerjee,Banerjee, Subroto T, India,1,6,  
 Sudangsu A Banerjee,Banerjee, Sudangsu A, India,1,  ,  
 Sanjay B Bangar,Bangar, Sanjay B, India,12,15,  
 Omari A C Banks,Banks, Omari A C, West Indies,10,5,  
 Alexander C Bannerman,Bannerman, Alexander C, Australia,28,  ,  
 Charles Bannerman,Bannerman, Charles, Australia,3,  ,  
 Eldine A E Baptiste,Baptiste, Eldine A E, West Indies,10,43,  
 Mohammed Baqua Jilani,Baqua Jilani, Mohammed, India,1,  ,  
 Adrian Barath,Barath, Adrian, West Indies,7,10,2
 Richard T Barber,Barber, Richard T, New Zealand,1,  ,  
 Robert W Barber,Barber, Robert W, England,28,  ,  
 Wilfred Barber,Barber, Wilfred, England,2,  ,  
 Warren Bardsley,Bardsley, Warren, Australia,41,  ,  
 Edgar J Barlow,Barlow, Edgar J, South Africa,30,  ,  
 Graham D Barlow,Barlow, Graham D, England,3,6,  
 Richard G Barlow,Barlow, Richard G, England,17,  ,  
 Sidney G Barnes,Barnes, Sidney G, Australia,13,  ,  
 Sydney F Barnes,Barnes, Sydney F, England,27,  ,  
 William Barnes,Barnes, William, England,21,  ,  
 Benjamin A Barnett,Barnett, Benjamin A, Australia,4,  ,  
 Charles J Barnett,Barnett, Charles J, England,20,  ,  
 Geoffrey E F Barnett,Barnett, Geoffrey E F, Canada,  ,22,5
 Kim J Barnett,Barnett, Kim J, England,4,1,  
 Christopher D Barnwell,Barnwell, Christopher D, West Indies,  ,  ,4
 Frederick Barratt,Barratt, Frederick, England,5,  ,  
 Wesley Barresi,Barresi, Wesley, Netherlands,  ,19,  
 Arthur G Barrett,Barrett, Arthur G, West Indies,6,  ,  
 John E Barrett,Barrett, John E, Australia,2,  ,  
 Kenneth F Barrington,Barrington, Kenneth F, England,82,  ,  
 Ivan Barrow,Barrow, Ivan, West Indies,11,  ,  
 Edward L Bartlett,Bartlett, Edward L, West Indies,5,  ,  
 Gary A Bartlett,Bartlett, Gary A, New Zealand,10,  ,  
 Paul T Barton,Barton, Paul T, New Zealand,7,  ,  
 Victor A Barton,Barton, Victor A, England,1,  ,  
 Miles C Bascombe,Bascombe, Miles C, West Indies,  ,  ,1
 Oronde Bascombe,Bascombe, Oronde, Bermuda,  ,6,1
 Dwight M Basden,Basden, Dwight M, Bermuda,  ,2,  
 Basit Ali,Basit Ali,, Pakistan,19,50,  
 Trevin C Bastiampillai,Bastiampillai, Trevin C, Canada,  ,11,2
 William Bates,Bates, William, England,15,  ,  
 Gareth J Batty,Batty, Gareth J, England,7,10,1
 Indika P P Batuwitarachchi,Batuwitarachchi, Indika P P, United Arab Emirates,  ,2,  
 Carlton S Baugh,Baugh, Carlton S, West Indies,16,42,1
 Harold V Baumgartner,Baumgartner, Harold V, South Africa,1,  ,  
 Bazid Khan,Bazid Khan,, Pakistan,1,5,  
 George Bean,Bean, George, England,3,  ,  
 Donald D Beard,Beard, Donald D, New Zealand,4,  ,  
 Graeme R Beard,Beard, Graeme R, Australia,3,2,  
 Rolland Beaumont,Beaumont, Rolland, South Africa,5,  ,  
 John E F Beck,Beck, John E F, New Zealand,8,  ,  
 Atul C Bedade,Bedade, Atul C, India,  ,13,  
 Bishen S Bedi,Bedi, Bishen S, India,67,10,  
 Alexander V Bedser,Bedser, Alexander V, England,51,  ,  
 Michael A Beer,Beer, Michael A, Australia,1,  ,  
 Denis W Begbie,Begbie, Denis W, South Africa,5,  ,  
 Alexander J Bell,Bell, Alexander J, South Africa,16,  ,  
 Ian R Bell,Bell, Ian R, England,69,108,7
 Matthew D Bell,Bell, Matthew D, New Zealand,18,7,  
 William Bell,Bell, William, New Zealand,2,  ,  
 John Benaud,Benaud, John, Australia,3,  ,  
 Richard Benaud,Benaud, Richard, Australia,63,  ,  
 Joseph E Benjamin,Benjamin, Joseph E, England,1,2,  
 Kenneth C G Benjamin,Benjamin, Kenneth C G, West Indies,26,26,  
 Winston K M Benjamin,Benjamin, Winston K M, West Indies,21,85,  
 Dale M Benkenstein,Benkenstein, Dale M, South Africa,  ,23,  
 Sulieman J Benn,Benn, Sulieman J, West Indies,17,25,17
 Hamish K Bennett,Bennett, Hamish K, New Zealand,1,12,  
 Murray J Bennett,Bennett, Murray J, Australia,3,8,  
 Mark R Benson,Benson, Mark R, England,1,1,  
 David E Bernard,Bernard, David E, West Indies,3,20,1
 Richard D Berrington,Berrington, Richard D, Scotland,  ,20,8
 Robert Berry,Berry, Robert, England,2,  ,  
 Brandon J Bess,Bess, Brandon J, West Indies,1,  ,  
 Carlisle A Best,Best, Carlisle A, West Indies,8,24,  
 Tino L Best,Best, Tino L, West Indies,14,12,  
 Nelson Betancourt,Betancourt, Nelson, West Indies,1,  ,  
 Michael G Bevan,Bevan, Michael G, Australia,18,232,  
 Amit Bhandari,Bhandari, Amit, India,  ,2,  
 Prakash Bhandari,Bhandari, Prakash, India,3,  ,  
 Vijay R R Bhardwaj,Bhardwaj, Vijay R R, India,3,10,  
 Adwai R Bhat,Bhat, Adwai R, India,2,  ,  
 Rustam A Bhatti,Bhatti, Rustam A, Canada,  ,1,  
 Umar Bhatti,Bhatti, Umar, Canada,  ,36,7
 Rajesh L Bhudia,Bhudia, Rajesh L, Kenya,  ,5,3
 Bhupinder Singh,Bhupinder Singh,, India,  ,2,  
 Andrew J Bichel,Bichel, Andrew J, Australia,19,67,  
 Martin P Bicknell,Bicknell, Martin P, England,4,7,  
 Grahame P Bilby,Bilby, Grahame P, New Zealand,2,  ,  
 Ian S Billcliff,Billcliff, Ian S, Canada,  ,19,2
 James G Binks,Binks, James G, England,2,  ,  
 Alfred P Binns,Binns, Alfred P, West Indies,5,  ,  
 Roger M H Binny,Binny, Roger M H, India,27,72,  
 Morice C Bird,Bird, Morice C, England,10,  ,  
 Jack Birkenshaw,Birkenshaw, Jack, England,5,  ,  
 Lionel S Birkett,Birkett, Lionel S, West Indies,4,  ,  
 Travis R Birt,Birt, Travis R, Australia,  ,  ,3
 Devendra Bishoo,Bishoo, Devendra, West Indies,8,13,4
 Glenn A Bishop,Bishop, Glenn A, Australia,  ,2,  
 Ian R Bishop,Bishop, Ian R, West Indies,43,84,  
 Murray Bisset,Bisset, Murray, South Africa,3,  ,  
 George F Bissett,Bissett, George F, South Africa,4,  ,  
 Marlon I Black,Black, Marlon I, West Indies,6,5,  
 John M Blackham,Blackham, John M, Australia,35,  ,  
 Donald D J Blackie,Blackie, Donald D J, Australia,3,  ,  
 Ian D Blackwell,Blackwell, Ian D, England,1,34,  
 John A R Blain,Blain, John A R, Scotland,  ,33,5
 Tony E Blain,Blain, Tony E, New Zealand,11,38,  
 Bruce R Blair,Blair, Bruce R, New Zealand,  ,14,  
 Robert W Blair,Blair, Robert W, New Zealand,19,  ,  
 Donovan L Blake,Blake, Donovan L, United States,  ,1,  
 Glenn Blakeney,Blakeney, Glenn, Bermuda,  ,2,  
 Richard J Blakey,Blakey, Richard J, England,2,3,  
 James M Blanckenberg,Blanckenberg, James M, South Africa,18,  ,  
 Kenneth C Bland,Bland, Kenneth C, South Africa,21,  ,  
 Gregory S Blewett,Blewett, Gregory S, Australia,46,32,  
 Ivo F W Bligh,Bligh, Ivo F W, England,4,  ,  
 Arnoldus M Blignaut,Blignaut, Arnoldus M, Zimbabwe,19,54,1
 Roger C Blunt,Blunt, Roger C, New Zealand,9,  ,  
 Colin Blythe,Blythe, Colin, England,19,  ,  
 John H Board,Board, John H, England,6,  ,  
 Ernest G Bock,Bock, Ernest G, South Africa,1,  ,  
 Gulam H Bodi,Bodi, Gulam H, South Africa,  ,2,1
 Nico Boje,Boje, Nico, South Africa,43,115,1
 Douglas E Bollinger,Bollinger, Douglas E, Australia,12,39,2
 Bruce A Bolton,Bolton, Bruce A, New Zealand,2,  ,  
 John B Bolus,Bolus, John B, England,7,  ,  
 Gerald E Bond,Bond, Gerald E, South Africa,1,  ,  
 Shane E Bond,Bond, Shane E, New Zealand,18,81,20
 Nkruma E Bonner,Bonner, Nkruma E, West Indies,  ,  ,1
 George J Bonnor,Bonnor, George J, Australia,17,  ,  
 Stephen L Boock,Boock, Stephen L, New Zealand,30,14,  
 David C Boon,Boon, David C, Australia,107,181,  
 Brian C Booth,Booth, Brian C, Australia,29,  ,  
 William Booth,Booth, William, England,2,  ,  
 Ravinda S Bopara,Bopara, Ravinda S, England,12,69,16
 Chandrakant G Borde,Borde, Chandrakant G, India,55,  ,  
 Delyone C Borden,Borden, Delyone C, Bermuda,  ,12,  
 Allan R Border,Border, Allan R, Australia,156,273,  
 Peter W Borren,Borren, Peter W, Netherlands,  ,49,9
 Scott G Borthwick,Borthwick, Scott G, England,  ,2,1
 Bernard J T Bosanquet,Bosanquet, Bernard J T, England,7,  ,  
 Tertius Bosch,Bosch, Tertius, South Africa,1,2,  
 Gopalkrishna Bose,Bose, Gopalkrishna, India,  ,1,  
 Lungile L Bosman,Bosman, Lungile L, South Africa,  ,14,14
 Jayawardene W H D Boteju,Boteju, Jayawardene W H D, Sri Lanka,  ,2,  
 Andre C Botha,Botha, Andre C, Ireland,  ,42,13
 Johan Botha,Botha, Johan, South Africa,5,77,28
 Ian T Botham,Botham, Ian T, England,102,116,  
 James T Botten,Botten, James T, South Africa,3,  ,  
 Mark V Boucher,Boucher, Mark V, South Africa,140,295,25
 Montague P Bowden,Bowden, Montague P, England,2,  ,  
 William E Bowes,Bowes, William E, England,15,  ,  
 Edward H Bowley,Bowley, Edward H, England,5,  ,  
 Keith D Boyce,Boyce, Keith D, West Indies,21,8,  
 Geoffrey Boycott,Boycott, Geoffrey, England,108,36,  
 Henry F Boyle,Boyle, Henry F, Australia,12,  ,  
 Brendon P Bracewell,Bracewell, Brendon P, New Zealand,6,1,  
 Douglas A J Bracewell,Bracewell, Douglas A J, New Zealand,1,2,2
 John G Bracewell,Bracewell, John G, New Zealand,41,53,  
 Nathan W Bracken,Bracken, Nathan W, Australia,5,116,19
 Grant E Bradburn,Bradburn, Grant E, New Zealand,7,11,  
 Wynne P Bradburn,Bradburn, Wynne P, New Zealand,2,  ,  
 Walter M Bradley,Bradley, Walter M, England,2,  ,  
 Donald G Bradman,Bradman, Donald G, Australia,52,  ,  
 Ian D R Bradshaw,Bradshaw, Ian D R, West Indies,5,62,1
 David H Brain,Brain, David H, Zimbabwe,9,23,  
 Carlos R Braithwaite,Braithwaite, Carlos R, West Indies,3,1,1
 Eddo A Brandes,Brandes, Eddo A, Zimbabwe,10,59,  
 William H Brann,Brann, William H, South Africa,3,  ,  
 Kraigg C Brathwaite,Brathwaite, Kraigg C, West Indies,1,  ,  
 Leonard C Braund,Braund, Leonard C, England,23,  ,  
 Darren M Bravo,Bravo, Darren M, West Indies,11,31,4
 Dwayne J J Bravo,Bravo, Dwayne J J, West Indies,40,117,22
 Jeremy P Bray,Bray, Jeremy P, Ireland,  ,15,2
 John M Brearley,Brearley, John M, England,39,25,  
 Walter Brearley,Brearley, Walter, England,4,  ,  
 Gareth R Breese,Breese, Gareth R, West Indies,1,  ,  
 Donald V Brennan,Brennan, Donald V, England,2,  ,  
 Gary B Brent,Brent, Gary B, Zimbabwe,4,70,3
 Timothy T Bresnan,Bresnan, Timothy T, England,10,57,20
 Gavin A Briant,Briant, Gavin A, Zimbabwe,1,5,  
 John Briggs,Briggs, John, England,33,  ,  
 Raymond J Bright,Bright, Raymond J, Australia,25,11,  
 James E Brinkley,Brinkley, James E, Scotland,  ,5,  
 Arthur W Briscoe,Briscoe, Arthur W, South Africa,2,  ,  
 Samuel A Britton,Britton, Samuel A, Ireland,  ,1,  
 Brian C Broad,Broad, Brian C, England,25,34,  
 Stuart C J Broad,Broad, Stuart C J, England,41,84,31
 William Brockwell,Brockwell, William, England,7,  ,  
 Henry D Bromfield,Bromfield, Henry D, South Africa,9,  ,  
 Ernest H Bromley,Bromley, Ernest H, Australia,2,  ,  
 Hugh R Bromley-Davenport,Bromley-Davenport, Hugh R, England,4,  ,  
 Dennis Brookes,Brookes, Dennis, England,1,  ,  
 Neil T Broom,Broom, Neil T, New Zealand,  ,22,9
 Alan Brown,Brown, Alan, England,2,  ,  
 Alistair D Brown,Brown, Alistair D, England,  ,16,  
 Darryl Brown,Brown, Darryl, West Indies,  ,3,  
 David J Brown,Brown, David J, England,26,  ,  
 Douglas R Brown,Brown, Douglas R, England,  ,25,1
 Frederick R Brown,Brown, Frederick R, England,22,  ,  
 George Brown,Brown, George, England,7,  ,  
 John T Brown,Brown, John T, England,8,  ,  
 Lennox S Brown,Brown, Lennox S, South Africa,2,  ,  
 Robin D Brown,Brown, Robin D, Zimbabwe,  ,7,  
 Simon J E Brown,Brown, Simon J E, England,1,  ,  
 Vaughan R Brown,Brown, Vaughan R, New Zealand,2,3,  
 William A Brown,Brown, William A, Australia,22,  ,  
 Barrington S Browne,Browne, Barrington S, West Indies,  ,4,  
 Courtney O Browne,Browne, Courtney O, West Indies,20,46,  
 Cyril R Browne,Browne, Cyril R, West Indies,4,  ,  
 Patrick A Browne,Browne, Patrick A, West Indies,  ,5,  
 Dean G Brownlie,Brownlie, Dean G, New Zealand,1,  ,2
 William Bruce,Bruce, William, Australia,14,  ,  
 Glen K Bruk-Jackson,Bruk-Jackson, Glen K, Zimbabwe,2,1,  
 Henderson R Bryan,Bryan, Henderson R, West Indies,  ,15,  
 Rudi E Bryson,Bryson, Rudi E, South Africa,  ,7,  
 Claude P Buckenham,Buckenham, Claude P, England,4,  ,  
 Carl E Bulfin,Bulfin, Carl E, New Zealand,  ,4,  
 Peter J P Burge,Burge, Peter J P, Australia,42,  ,  
 Andries J Burger,Burger, Andries J, Namibia,  ,6,  
 Christopher G De V Burger,Burger, Christopher G De V, South Africa,2,  ,  
 Louis J Burger,Burger, Louis J, Namibia,  ,6,  
 Sarel F Burger,Burger, Sarel F, Namibia,  ,2,  
 Mark G Burgess,Burgess, Mark G, New Zealand,50,26,  
 Cecil Burke,Burke, Cecil, New Zealand,1,  ,  
 James W Burke,Burke, James W, Australia,24,  ,  
 Sydney F Burke,Burke, Sydney F, South Africa,2,  ,  
 Mark G Burmester,Burmester, Mark G, Zimbabwe,3,8,  
 Kenneth E Burn,Burn, Kenneth E, Australia,2,  ,  
 Frederick J Burton,Burton, Frederick J, Australia,2,  ,  
 Thomas B Burtt,Burtt, Thomas B, New Zealand,10,  ,  
 Iain P Butchart,Butchart, Iain P, Zimbabwe,1,20,  
 Alan R Butcher,Butcher, Alan R, England,1,1,  
 Basil F Butcher,Butcher, Basil F, West Indies,44,  ,  
 Mark A Butcher,Butcher, Mark A, England,71,  ,  
 Roland O Butcher,Butcher, Roland O, England,3,3,  
 Deighton C Butler,Butler, Deighton C, West Indies,  ,5,1
 Harold J Butler,Butler, Harold J, England,2,  ,  
 Ian G Butler,Butler, Ian G, New Zealand,8,26,15
 Lennox S Butler,Butler, Lennox S, West Indies,1,  ,  
 Harry R Butt,Butt, Harry R, England,3,  ,  
 K Hussain Butt,Butt, K Hussain, Hong Kong,  ,2,  
 Leornard A Butterfield,Butterfield, Leornard A, New Zealand,1,  ,  
 Clyde G Butts,Butts, Clyde G, West Indies,7,  ,  
 Atse F Buurman,Buurman, Atse F, Netherlands,  ,17,4
 Izak D Buys,Buys, Izak D, South Africa,1,  ,  
 Michael R Bynoe,Bynoe, Michael R, West Indies,4,  ,  
